{
  "$id": "user-abc123",
  "name": "Jane Developer",
  "email": "jane@example.com",
  "phone": "+15551234567",
  "emailVerification": true,
  "phoneVerification": false,
  "status": true,
  "createdAt": "2026-01-01T12:00:00Z",
  "updatedAt": "2026-04-01T09:30:00Z",
  "labels": [
    "beta-tester",
    "premium"
  ]
}